{
  "$schema" : "http://json-schema.org/draft-07/schema#",
  "type": "object",
  "required": [
    "contextId",
	"contextName",
    "description",
    "permissions",
    "roles"
  ],
  "properties": {
    "id": {
      "type": "string"
    },
	"contextId": {
	  "type": "string"
	},
    "contextName": {
      "type": "string"
    },
    "description": {
      "type": "string"
    },
    "permissions": {
      "type": "array",
      "items": {
        "type": "string"
      },
	  "minItems": 1,
	  "uniqueItems": true
    },
    "roles": {
      "type": "array",
      "items": {
        "$ref": "Role.json"
      },
	  "minItems": 1
	},
    "enabled": {
      "type": "boolean"
    },
	"transactionId": {
	  "type": "string"
	},
	"createdBy": {
	  "type": "string"
	},
	"modifiedBy": {
	  "type": "string"
	},
	"createdTime": {
	  "type": "string"
	},
	"modifiedTime": {
	  "type": "string"
	}
  }
}
